{"artifact_bytes": 289, "dataset": "0779d3fd5b3133a2", "elapsed_seconds": 13.537, "exit_code": 0, "loss_rows": 8192, "max_rss_kib": 947664, "official_tests_opened": false, "profile": "features12_steps8192", "replaces_scored_artifact": false, "selected_candidate": "compact_neural_residual_symbolic", "status": "ok"}
