{"artifact_bytes": 520, "dataset": "e5a3a7b3668a1cc2", "elapsed_seconds": 6.286, "exit_code": 0, "loss_rows": 2048, "max_rss_kib": 946884, "official_tests_opened": false, "profile": "features12_steps2048", "replaces_scored_artifact": false, "selected_candidate": "compact_neural_residual_symbolic", "status": "ok"}
