{"artifact_bytes": 600, "dataset": "1a803b27c2400dc4", "elapsed_seconds": 4.17, "exit_code": 0, "loss_rows": 2048, "max_rss_kib": 934788, "official_tests_opened": false, "profile": "features12_steps2048", "replaces_scored_artifact": false, "selected_candidate": "compact_neural_residual_symbolic", "status": "ok"}
