{"artifact_bytes": 294, "dataset": "693890aae9dc860b", "elapsed_seconds": 16.161, "exit_code": 0, "loss_rows": 8192, "max_rss_kib": 944504, "official_tests_opened": false, "profile": "features12_steps8192", "replaces_scored_artifact": false, "selected_candidate": "compact_neural_residual_symbolic", "status": "ok"}
