{"artifact_bytes": 1770, "dataset": "e68fdd96cc63271b", "elapsed_seconds": 13.762, "exit_code": 0, "loss_rows": 8192, "max_rss_kib": 953664, "official_tests_opened": false, "profile": "features12_steps8192", "replaces_scored_artifact": false, "selected_candidate": "compact_neural_residual_symbolic", "status": "ok"}
