{"artifact_bytes": 9273, "elapsed_seconds": 5.003, "exit_code": 0, "loss_rows": 2048, "max_rss_kib": 921312, "name": "musk", "official_test_opened": false, "profile": "features12_steps2048", "selected_candidate": "compact_neural_residual_symbolic", "status": "ok", "task": "binary", "within_l3_cap": true}
