{"artifact_bytes": 278, "dataset": "04c80944e971cb3e", "elapsed_seconds": 16.765, "exit_code": 0, "loss_rows": 8192, "max_rss_kib": 943484, "official_tests_opened": false, "profile": "features12_steps8192", "replaces_scored_artifact": false, "selected_candidate": "compact_neural_residual_symbolic", "status": "ok"}
