{"artifact_bytes": 610, "dataset": "9312d813229df035", "elapsed_seconds": 15.709, "exit_code": 0, "loss_rows": 8192, "max_rss_kib": 959724, "official_tests_opened": false, "profile": "features12_steps8192", "replaces_scored_artifact": false, "selected_candidate": "compact_neural_residual_symbolic", "status": "ok"}
