{"artifact_bytes": 716, "dataset": "edc9d41a298fdf60", "elapsed_seconds": 13.781, "exit_code": 0, "loss_rows": 8192, "max_rss_kib": 949548, "official_tests_opened": false, "profile": "features12_steps8192", "replaces_scored_artifact": false, "selected_candidate": "compact_neural_residual_symbolic", "status": "ok"}
