{"artifact_bytes": 1209, "dataset": "0a8428ef25a69175", "elapsed_seconds": 14.544, "exit_code": 0, "loss_rows": 8192, "max_rss_kib": 949572, "official_tests_opened": false, "profile": "features12_steps8192", "replaces_scored_artifact": false, "selected_candidate": "compact_neural_residual_symbolic", "status": "ok"}
