{"artifact_bytes": 1973, "dataset": "a97065df07a47eb0", "elapsed_seconds": 4.664, "exit_code": 0, "loss_rows": 2048, "max_rss_kib": 950596, "official_tests_opened": false, "profile": "features12_steps2048", "replaces_scored_artifact": false, "selected_candidate": "compact_neural_residual_symbolic", "status": "ok"}
