{"artifact_bytes": 6288, "dataset": "654566a1f91408aa", "elapsed_seconds": 13.657, "exit_code": 0, "loss_rows": 8192, "max_rss_kib": 951656, "official_tests_opened": false, "profile": "features12_steps8192", "replaces_scored_artifact": false, "selected_candidate": "compact_neural_residual_symbolic", "status": "ok"}
