{"artifact_bytes": 1783, "dataset": "fc3812567b5fdd64", "elapsed_seconds": 5.488, "exit_code": 0, "loss_rows": 2048, "max_rss_kib": 951764, "official_tests_opened": false, "profile": "features12_steps2048", "replaces_scored_artifact": false, "selected_candidate": "compact_neural_residual_symbolic", "status": "ok"}
