{"artifact_bytes": 1967, "dataset": "956d34f13e7af830", "elapsed_seconds": 16.388, "exit_code": 0, "loss_rows": 8192, "max_rss_kib": 947652, "official_tests_opened": false, "profile": "features12_steps8192", "replaces_scored_artifact": false, "selected_candidate": "compact_neural_residual_symbolic", "status": "ok"}
