{"artifact_bytes": 1991, "dataset": "26eff843be35d831", "elapsed_seconds": 4.169, "exit_code": 0, "loss_rows": 2048, "max_rss_kib": 948016, "official_tests_opened": false, "profile": "features12_steps2048", "replaces_scored_artifact": false, "selected_candidate": "compact_neural_residual_symbolic", "status": "ok"}
