{"artifact_bytes": 818, "elapsed_seconds": 14.009, "exit_code": 0, "loss_rows": 8192, "max_rss_kib": 880064, "name": "airfoil_self_noise", "official_test_opened": false, "profile": "features12_steps8192", "selected_candidate": "compact_neural_residual_symbolic", "status": "ok", "task": "regression", "within_l3_cap": true}
