{"artifact_bytes": 885, "dataset": "1a4456d1cc71a26a", "elapsed_seconds": 14.521, "exit_code": 0, "loss_rows": 8192, "max_rss_kib": 950948, "official_tests_opened": false, "profile": "features12_steps8192", "replaces_scored_artifact": false, "selected_candidate": "compact_neural_residual_symbolic", "status": "ok"}
